{
  "$schema": "./schemas/reward-config.schema.json",
  "version": "1.0.0",
  "updatedAt": "2025-08-08",
  "syncoin": {
    "minPerMatch": 5,
    "maxPerMatch": 30,
    "perScoreDivisor": 100,
    "perCorrectAnswer": 1,
    "rankingBonus": { "1": 6, "2": 4, "3": 2, "4-8": 1 },
    "achievementBonus": {
      "perfectQuiz": 2,
      "speedDemon": 2,
      "streakMaster": 2,
      "comebackKing": 3
    }
  },
  "xp": {
    "participation": 10,
    "perCorrect": 5,
    "perScoreDivisor": 50,
    "rankingXp": { "1": 100, "2": 75, "3": 50, "4-6": 25, "7-8": 10 },
    "achievementXp": {
      "perfectQuiz": 150,
      "speedMaster": 100,
      "streakMaster": 75,
      "comebackKing": 60
    }
  },
  "antiAbuse": {
    "coinSoftCapPerHour": 200,
    "xpSoftCapPerHour": 2000
  }
}
